{
  "schema_version": 1,
  "kind": "mere.run/workflow-graph",
  "name": "train-style-and-sample",
  "inputs": {
    "dataset": { "type": "asset_directory" },
    "prompt": { "type": "string" }
  },
  "nodes": [
    {
      "id": "train-style",
      "kind": "image.train-lora",
      "arguments": {
        "data": { "$ref": "inputs.dataset" },
        "width": 256,
        "height": 256,
        "max_text_length": 128,
        "lite": true,
        "base_quantization_bits": 4,
        "rank": 4,
        "training_steps": 10
      }
    },
    {
      "id": "sample-style",
      "kind": "image.generate",
      "arguments": {
        "prompt": { "$ref": "inputs.prompt" },
        "model": "image-krea2-turbo",
        "krea_base_quantization_bits": 4,
        "width": 256,
        "height": 256,
        "lora": { "$ref": "nodes.train-style.outputs.adapter" }
      }
    }
  ],
  "outputs": {
    "adapter": { "$ref": "nodes.train-style.outputs.adapter" },
    "sample": { "$ref": "nodes.sample-style.outputs.image" }
  }
}
